{
  "schema_version": 1,
  "tool": {
    "name": "maintainer-defense",
    "version": "1.1.0"
  },
  "target": "/private/tmp/amd-v1.1.0-pilot.aKkXR1",
  "summary": {
    "total": 0,
    "by_severity": {
      "critical": 0,
      "high": 0,
      "medium": 0,
      "low": 0,
      "note": 0
    }
  },
  "findings": []
}
